,0
81,"
Sou feliz por ter este filho tão maravilhoso


                                    Eu sou seu pai! Sempre serei! E nada me envaidece tanto como meu sangue correr nas suas veias. Meu filho, você é tudo aquilo que sempre desejei ter na vida. Nada me deixa tão entusiasmado como ver seu corpo e mentalidade crescerem assim tão felizes!

Sou um homem abençoado e confesso que minha vida não seria tão colorida e alegre se você não existisse, meu querido! Continue a evoluir um pouco todos os dias e nunca se esqueça que estarei sempre junto para lhe proporcionar seu melhor sorriso.

Continue correndo atrás de todos seus sonhos e não desista de perseguir tudo aquilo em que acredita. Um homem não se faz de acasos da vida, mas de conquistas alcançadas através do sangue, suor e lágrimas. Força, meu filho, seja sempre feliz! Te amo.                                


"
82,"
A alegria de ver minha filha crescer


                                    Ninguém nos conta quanto nossa vida irá mudar depois de termos uma filha. Comigo foi assim, minha princesa. Você chegou virando meu mundo de pernas para o ar.

Mas não posso reclamar, pois todas as vezes que olho seu sorriso, eu sorrio junto.
Eu virei pai do dia para a noite, mas ainda estou aprendendo o verdadeiro significado disso. Divido as aprendizagens com você. Vou descobrindo tudo enquanto vejo você crescer.

Minha filha é minha maior felicidade e nada no mundo paga a sensação de vê-la se tornar uma mulher. Amo você, filhota!                                


"
83,"
Não teria conseguido terminar o TCC sem vocês


                                    A Deus, todo poderoso, agradeço pela força e proteção de sempre.

Agradeço à Universidade que guiou meus caminhos e me deu um rumo na vida. Aos seus professores que me formaram não só para a atividade profissional, mas também para a vida.

Ao meu professor orientador que foi muito importante no processo de desenvolvimento deste trabalho.

Agradeço à minha família, que quase não tenho palavras para descrever sua importância em minha vida. Pai e mãe, eu nunca teria conseguido sem o apoio de vocês. Obrigado por tudo, de coração.

Por último quero lembrar aqueles que fizeram parte indiretamente da minha caminhada, meus amigos que sempre me incentivaram a correr atrás dos meus sonhos.

Agradeço muito à cada um de vocês!                                


"
84,"
Quero ser um grande exemplo para meu filho


                                    Desde que você nasceu, filho, fico me perguntando, afinal o que é ser pai? Acho que cada um é pai do seu jeito.

Eu tento sempre ser o melhor exemplo que posso. Tento ensinar o que aprendi na vida e tento ter a cabeça aberta. A verdade é que os pais também aprendem muito quando os filhos nascem.

Você me ensinou sobre o amor, querido filho. Aprendi a amar de uma forma incondicional e devo isso a você.

Minha vida mudou de cabeça para baixo e creio que continuará mudando. Mas tudo vale a pena quando recebo seu abraço ao chegar em casa e quando vejo você crescendo aos poucos.

Estarei ao seu lado em todos os passos da sua caminhada, filho, tentando ser um grande exemplo para que você se torne um grande homem!                                


"
85,"
Meu bebê está completando seu 1º mês e eu me emociono


                                    Sou um pai emocionado por ver o meu bem mais precioso completar seu 1º mês de vida. Não há nada melhor do que ver o meu bebê crescer com saúde e alegria.

Sei que uma vida logo espera por você e eu estarei aqui para acompanhar cada um dos seus passos. Estarei sempre disposto a fazer tudo que posso para ver o seu sorriso.

Você é meu orgulho, minha alegria, minha maior felicidade, meu bebê! Feliz mesversário!                                


"
86,"
Palavras de um Bebê para seu Papai


                                    Ainda não nos vimos, papai, e eu já sinto um amor incontrolável por você. Sou o bebê mais sortudo que existe por ter um pai atencioso, amoroso e muito carinhoso. Não vejo a hora de olhar seu rosto. 

Sempre que você passa sua mão na barriga da mamãe eu sinto algo inexplicável. Parece que toca no meu coração também. São coisas que não se explicam; são coisas que se sentem.                                


"
87,"
Aniversário de casamento dos meus queridos pais


                                    Estas palavras são dedicadas a um casal muito especial que hoje recordam um dia muito importante para todos nós. Até porque se vocês não se casassem, talvez eu não estaria aqui para dar estes sinceros parabéns, meus queridos pais.

O exemplo de amor, lealdade e cumplicidade que vocês têm mostrado ao longo desses lindos anos de casamento enchem meu coração de orgulho. Desejo que mais anos assim possam acontecer e que Deus abençoe muito nossa família! 


"
88,"
A doença do meu pai


                                    Se eu pudesse você não estaria mais doente nem saberia sequer o que é a dor ou a infelicidade de sensações duras. Pai, você está doente e a situação não está sendo fácil, mas eu sei que você tem força para superar este desafio.

Lembre-se que eu estarei sempre perto para lhe dar ânimo e nunca o deixar sozinho. Na verdade, faço exatamente o que você me faria se e estivesse na sua condição. 

Pense positivo! Erga sua cabeça e não desista. Às vezes as coisas complicam, mas você é um guerreiro! Toda vida você me ensinou que não devemos ter medo, por isso chegou a hora de você me mostrar o que é ser verdadeiramente batalhador.

Força, pai!
Você vai conseguir.                                


"
89,"
Meu pai, meu amigo, meu herói, meu tudo


                                    Meu pai, toda minha vida você tem sido uma estável referência, o meu maior exemplo, a minha verdadeira inspiração. Você é o meu herói, aquele a quem sempre olharei como se fosse uma divindade.

Meu pai, hoje eu quero agradecer por tudo que você já fez e continua fazendo por mim, e lhe dizer que o meu amor por você é maior que o infinito e tão inesgotável quanto o tempo.

Você é meu pai, meu amigo, meu herói, meu tudo! Eu te amo!                                


"
90,"
Feliz aniversário, meu pai


                                    Hoje é dia de alegria e festa, pois o meu herói, o meu querido e amado pai completa mais um ano de vida. Feliz aniversário! 

Espero que este dia traga muitas coisas boas e que seja tal como você deseja. E assim espero que sejam todos os outros dias da sua vida. Você merece ser sempre muito feliz, meu pai, pois é o melhor homem que algum dia conheci e foi e é o melhor pai que alguém pode sonhar ter. 

Amo muito você, papai, e apenas desejo felicidade e que esta data se repita muitos e muitos anos. Parabéns!                                


"
91,"
A proteção que o papai me dá


                                    Querido papai. Não faz muito tempo que eu cheguei, mas já sei que sou muito amado e que você vai estar comigo durante toda a minha vida sempre me protegendo e me ajudando em tudo.

Como é gostoso dormir no conforto do seu colo e saber que vim para uma família linda e que eu tenho o melhor pai do mundo

Prometo que vou fazer de tudo para fazer você orgulhoso de mim e que vou te amar tanto quanto você me ama. Agradeço muito por você ser o meu papai.                                


"
92,"
Gravidez Complicada e Maravilhosa


                                    Um dos privilégios da mulher é a gravidez. Eita coisa complicada e maravilhosa. Sentimos de tudo: enjoo, cãibras, dor nas costas, dor na bacia, incômodo ao deitar, vontade de comer de tudo, apesar que grávida pode comer de tudo sem culpa… Quem iria recriminar uma grávida por comer?

Do outro lado, pensamos nas estrias, nas celulites, se vamos emagrecer logo, se ficaremos flácidas, se voltaremos ao “normal” logo. E a ansiedade… isso nem se fala, embora todas as nossas emoções fiquem mais fortes neste período.

Pensamos em como será nosso bebê, se ele irá chorar muito; se vai ser perfeitinho, se irá se parecer com a gente ou com o pai. E tem o nome também; aquela famosa listinha que vamos olhando, escrevendo e imaginando a gente gritando o nome escolhido o resto das nossas vidas.

E o medo principalmente se dará tempo de chegarmos na maternidade. Vai que ele se apresse e queira logo nascer. E chega a grande hora…..e aquele chorinho, aquela carinha… Ai que sensação maravilhosa!

Tudo vale muito a pena, e quando nasce nosso bebê, percebemos como é maravilhoso ser mãe. E logo já fazemos planos do próximo... Como é bom ser mãe!

(Papos Femininos)                                


"
93,"
Um pai orgulhoso pela sua formatura, filha


                                    Testemunhei seu esforço e dedicação, as horas gastas atrás de seu sonho, as noites que passou acordada e os dissabores e ansiedades. Todo trabalho é recompensado e é com muita emoção e orgulho que vejo você conseguir a formatura pela qual tanto batalhou, filha.

Sou o pai mais feliz do mundo ao ver sua felicidade com esse passo importante no seu percurso de vida. Que seja apenas o primeiro de muitos. Parabéns, minha filha querida!                                


"
94,"
Preciso de você ao meu lado, papai


                                    Hoje estou nos seus braços, papai. Entre choros ensurdecedores, e períodos de sono profundo, estou aí para ser acarinhado, protegido e guiado na melhor direção. 

É um mundo novo, o ar entrado pelas primeiras vezes nos meus pulmões, a batida do meu coração ainda em ritmo suave. Preciso de você ao meu lado e ao lado da mamãe. Eu sei que juntos podemos ser uma família muito feliz.

Seremos os melhores amigos, viveremos momentos inesquecíveis juntos, e vamos aprender muito um com o outro. Papai, tenho muito orgulho nessa palavra, e é maravilhoso todo amor que já sinto por você.                                


"
95,"
Com amor e saudade para pai que está longe

 


                                    Meu querido pai, que saudades do tempo em que podia me aconchegar no conforto dos seus braços a qualquer momento. 

Que saudades das nossas conversas, do seu carinho e atenção. Que saudades de ter você sempre pertinho de mim.

Agora a vida nos empurrou para longe um do outro. Mas seja onde e como for, você está sempre comigo, no meu coração, no meu pensamento, na minha saudade. 

Um abraço distante mas apertado, e um beijo carregado de amor e saudade. Eu te amo, meu pai!                                


"
96,"
Ao melhor marido e pai


                                    Ao melhor marido, melhor amigo, melhor companheiro, melhor pai, hoje nós queremos desejar um dia maravilhoso e que esteja à altura de todo o seu merecimento. Feliz aniversário! 

Com você como marido e pai a vida é mais fácil, divertida, interessante e segura. Você é um marido presente e carinhoso, um pai amoroso e protetor, e um homem que é um exemplo para todo o seu gênero. 

Nós amamos muito você, e hoje e sempre desejamos a sua felicidade, que essa data se repita por muitos e bons anos, e que através deles estejamos sempre juntos!                                


"
97,"
A minha carta para meus pais

 


                                    Pai, mãe,

Eu só conheço a felicidade. Às vezes acordo com fome, outras com sede, mas nunca me senti triste até ao dia de hoje. Sou bebê, sou feliz, nasci no berço que todos os bebês deveriam nascer: no berço do amor.

Sei que jamais conhecerei a solidão. Tenho ao meu lado as pessoas que me deram vida e me acompanharão ao longo da minha caminhada que tem tudo para ser grandiosa. Com pais assim como poderia não ser confiante?

Não se inibam de me dar presentes, beijos e de me embalar com entusiasmo e dedicação. Façam tudo do jeito com sabem, com amor e emoção. Quando eu crescer irei reconhecer todo esforço que hoje fazem por mim.                                


"
98,"
Admiro as suas qualidades como pai, amigo

 


                                    Você foi sempre uma pessoa que eu muito admirei e cujo o exemplo de fé eu procurei seguir, querido amigo. 

Mas admiro ainda mais as suas qualidades como pai, a forma como ensina os seus filhos o caminho de Deus e de como eles respeitam a sua palavra. 

Tenha um Dia dos Pais feliz na companhia de seus filhos e de Deus!                                


"
99,Mundo das Mensagens
100,"
Os sentimentos que nos ligam, pai



"
101,"
Ser pai é amar com todo coração

 


                                    Ser pai é uma responsabilidade, mas também um privilégio sem igual. É amar com todo coração; é cuidar, proteger e lutar pela felicidade dos seus filhos. 

Ser pai é ser herói e ter o poder de fazer seus filhos felizes. Pois não há obstáculo grande demais para um pai que ama seus filhos, nem amor que se iguale. 

Ser pai é a profissão mais importante que um homem pode exercer na vida, e aquela que mais fortuna lhe vai trazer.                                


"
102,"
Um Aniversário de Emoções Fortes, Papai


                                    Parabéns, papai! Estou muito feliz por testemunhar mais um aniversário seu. Você é um pai exemplar, puro e maravilhoso. É o homem da minha vida, o ser humano mais incrível que algum dia conheci. 

Desejo que todos os momentos de hoje sejam leves, alegres e repletos de paz e amor. Gosto muito de você, papai, e por isso lhe desejo um aniversário repleto de emoções fortes e inesquecíveis. Feliz Aniversário!                                


"
103,"
É Bom Voltar Para Casa


                                    Piriá e e Smilinguido estavam conversando sobre uma história do Livro da Vida que o mestre tinha contado.
E Piriá disse que já pensou como o filho mais novo da história, que foi embora de casa, porque queria viajar e conhecer o mundo, conhecer novas formigas.
O rapaz na história gastou todo o dinheiro que o seu pai havia dado, e começou a passar fome! Como ninguém o ajudou resolveu voltar para casa para trabalhar como empregado de seu pai, mas ao chegar em casa seu pai ficou tão feliz que fez um festa para comemorar a volta do seu filho!
O Smilinguido perguntou o que tinha feito o Piriá mudar de idéia e ele disse que ainda gostava muito de aventuras, mas que se sentiu igual ao rapaz não quando saiu de casa mas quando voltou, pois ao chegar em casa Piriá recebeu um abraço caloroso de quem o ama, teve comida e uma cama quentinha para dormir, viu seus amigos...
E Piriá entendeu que às vezes queremos coisas que não são tão boas quanto imaginamos. é melhor ficar feliz com o que temos.

(Cristina Welzel da Silva)                                


"
104,"
Um Adeus a Saudade


                                    A saudade dói! A saudade traz todo gênero de recordações. A saudade existe e ganha corpo dentro da nossa mente e no nosso coração. Desde a hora que você foi embora, pai, tudo perdeu a cor. 

E só agora começo a acordar com outro espírito; com outra alegria de viver, porque é isso que você sempre desejou para mim: que eu seja feliz. Até um dia, meu pai! Te amo eternamente.                                


"
105,"
A Paixão de Um Filho


                                    Não tenho medo do que possa acontecer, porque tenho certeza que tudo vai acabar bem. Você vai sair dessa! Essa doença vai desaparecer rapidamente, e em breve vamos estar rindo de todos esses momentos difíceis que estamos atravessando, meu pai. 

Você é forte, batalhador e um homem muito bom. Só peço que continue acreditando – agarre a esperança e lute com todas suas forças. Eu vou estar sempre de seu lado! Te adoro, pai!                                


"
106,"
Ser um bom pai


                                    Ser um bom pai é amar, cuidar, proteger; e de todos você é o melhor, papai!                                


"
107,"
Meu Guia Eterno


                                    Meu GUIA ETERNO,
exemplo de bondade
disposto a ajudar aquele que precisa.

Meu PAI querido
com o dom de consolar
me ensina a amar e a perdoar.

GRANDE HOMEM
nos torna para sempre criança
nos dá carinho, afeto e esperança...

Com amor de filho
escrevo esse verso
para que saiba o quão te admiro.

Agradeço pela SORTE que tenho
por ter uma pessoa assim ao meu lado.

Desejo a todos a mesma sorte
De poder amar...
Ser amado ...
E ser querido por uma pessoa
que é tão importante como você.

EU TE AMO PAPAI!                                


"
108,"
Desejo um aniversário alegre como você, pai


                                    Que este dia seja alegre e feliz como você, pai! O seu bom humor ilumina meus dias e hoje, no seu aniversário, espero que toda esta felicidade volte em dobro para você.

Eu tenho muito orgulho de ser sua filha e me sinto muito grata porque você é uma pessoa muito especial. Que seu dia seja inesquecível e que possa aproveitar muito.

Feliz aniversário, pai! Amo muito você!                                


"
109,"
Agradecimento aos melhores pais do mundo


                                    De todos os amores que podemos receber durante a vida, o amor dos nossos pais é o mais especial. Não existe outro que consiga ser incondicional, e demonstrar ao mesmo tempo um interesse tão grande e genuíno na nossa felicidade.

Apenas posso agradecer por tudo que vocês têm me dado, pois nunca conseguirei compensar devidamente a dedicação que sempre manifestaram. 

Vocês são uma bênção sem comparação e só espero que um dia os meus filhos possam sentir um orgulho igual por mim.                                


"
110,"
Futuro paizão, você é o maior


                                    Você é dono de uma emotividade sem igual, que comove e inspira tudo e todos ao seu redor. Em breve, você será um papai babão com seu neném tão amado e desejado! Parabéns, futuro paizão! 

Eu sei que você está já perdido de amores por esse ser incrível que ainda nem conhece. Sei também que quando esse bebê, quando nascer, irá imediatamente amar você, sentir algo que será para toda vida.

Nunca mude! Continue essa pessoa maravilhosa, capaz de proezas inacreditáveis, de proporcionar o bem sem pedir algo em troca. São esses valores seu novo amor irá adotar, graças a você. 

Parabéns, papai! 


"
111,"
Uma pequena homenagem para você, pai


                                    Ser pai nem sempre é fácil, pois até as melhores coisas da vida às vezes são complicadas. Mas há pais que fazem tudo parecer fácil e simples por serem tão perfeitos, e o melhor entre os melhores é você, papai. 

Sempre amigo, sempre comigo, hoje sei que tive muita sorte por crescer com um pai como você. Esta pequena homenagem é para você, para agradecer por tudo e dizer que eu amo muito você!                                


"
112,"
Deus me enviou você, filho

 


                                    Deus me enviou você para me ensinar o verdadeiro poder do amor, filho.                                


"
113,"
Parabéns, futuro papai

 


                                    Parabéns, futuro papai, pois em breve terá seu bebê nos braços! A família cresce mais um pouco, e também seu coração se enche de mais amor. 

Todos sabemos que você é um grande pai, e sei que mais uma vez você vai provar isso. Esse bebê que está chegando nem imagina a sorte que tem por ir conhecer você como pai. 

Espero que a felicidade continue também crescendo na sua casa, e que Deus abençoe a todos da sua linda família!                                


"
114,"
Tenho orgulho de se pai de uma menina tão especial


                                    Você é meu maior orgulho e o maior motivo da minha felicidade, filha. Quando me tornei pai, não sabia o que esperar, mas quando segurei você no colo pela primeira vez, tudo ficou claro para mim.

Fui tomado de um instinto protetor e o amor que senti naquele momento foi o sentimento mais puro do mundo. Você é tudo para mim, filhinha, e eu estarei sempre ao seu lado. É muito bom vê-la crescer e sentir que estou fazendo um bom trabalho.

Amo você do fundo do meu coração, filha, e tenho muito orgulho em ser seu pai!                                


"
115,"
Um futuro pai herói


                                    Um pai pode ser um herói, nem que seja só para seu filho, mas acho que ele tem a obrigação de o ser. E se alguém o conseguirá sem esforço, essa pessoa será você com toda certeza. Parabéns, futuro papai! Aproveite todos os momentos com seu bebê!

Claro que tudo muda agora: as noites serão mal dormidas, a paciência terá de ser maior para aquele ser tão pequeno que precisa de tanta tão boa atenção. Mas eu sei que você será capaz de tudo com naturalidade. Tenha calma e seja fiel à pessoa incrível que sempre foi. Curta muito sua vida de papai!                                


"
116,"
Oração de Boa Semana


                                    Vem Jesus! Vem meu forte Protetor! 
Dá a este Teu humilde servo 
paz na semana que se inicia. 
Inunda meu cérebro com bons 
pensamentos e concede a 
meu corpo saúde e vigor.  

Transmite-me Tua força e coragem 
e faz-me sentir que estás sempre 
comigo, para enfrentarmos juntos, 
vitoriosos, os fardos de cada dia.  

Abranda minhas agitações e 
atropelos e dá-me discernimento 
para escolher os caminhos melhores 
e mais santos, na vontade do Pai.  

Vem filho de Deus! Fazer desta 
semana a Tua semana, para 
que eu possa repartir o amor 
que Tu me dás. E todo o bem 
que eu fizer, prometo, 
será sempre por Ti.  Amém!                                


"
117,"
A dádiva da vida é das maiores maravilhas da natureza


                                    A dádiva da vida é das maiores maravilhas da natureza que, brevemente, você irá poder experienciar.

Muitas felicidades pelo bebê que está a caminho. Você irá ser, sem dúvida alguma, um excelente pai.

Não se esqueça que o tempo voa, por isso, quando o neném chegar, aproveite muito bem todos os momentos que puder passar com ele.

Mais uma vez, os meus parabéns.                                


"
118,"
Uma missão de pai


                                    Mais do que um compromisso será uma missão de vida cuidar e guiar esse ser que fará você um pai orgulhoso e feliz!                                


"
119,"
O jeito de amar um padrasto de verdade


                                    Meu padrasto, meu amigo, você estará sempre no meu coração! Gosto de você do mesmo jeito que um filho gosta do seu pai. É que na verdade você é mais do que um padrasto; bem mais; você é um pai para mim.

Pessoas como você são únicas, autênticos exemplares do que existe de melhor neste mundo. E eu agradeço à vida por ter nos unido e a você por ter me proporcionando momentos de muita felicidade. Gosto muito de você!                                


"
120,"
O amor maior de uma tia


                                    Uma tia consegue amar seus sobrinhos igual uma mãe ama seus filhos. É um sentimento nobre, maior e quase sem explicação. Quem tem uma tia assim tem uma amiga fiel para sempre!

Aquela titia que está sempre atenta, preocupada e é dono de mil conselhos na hora certa merece ser reconhecida com alguém especial. Ela faz o papel de uma mãe ou pai. Ela é incrível!                                


"
121,"
Meu pai ainda faz parte de mim


                                    Já faz tempo que você partiu, mas ainda sinto seus sinais, querido pai, e uma saudade que já faz parte de mim.                                


"
122,"
Seja sempre meu pai herói


                                    Eu sei que você faz tudo por mim, por isso eu lhe peço que seja sempre meu herói e nunca me desiluda. Sou um bebê indefeso que precisa da sua proteção como você de água para beber. Pai, seja sempre meu ídolo!

Eu sou ainda uma criança, mas vou crescer e quando for mais velho vou agradecer. Não demonstrarei minha gratidão somente com palavras, mas sim com gestos e atitudes da alma e coração. 

Vou fazer muitas asneiras, brigar por coisas pequenas, minúsculas até. Vou chorar para comer e vai parecer que estou morrendo de fome; vou cair e machucar minha cabeça, crescer, evoluir.

E eu preciso que você seja meu ídolo. E acredite que não é uma missão muito difícil, basta que esteja ao meu lado para testemunhar todas as etapas da minha vida. Eu amo você incondicionalmente, meu pai herói!                                


"
123,"
Um maravilhoso presente para um futuro papai


                                    Há um acontecimento muito especial que brevemente mudará sua vida para sempre, e eu estou muito feliz só de imaginar o entusiasmo que está sentindo. Você será pai, e esse é um papel que traz grandes responsabilidades, mas com certeza ele será desempenhado com esforço e, sobretudo, muito amor.

Tire pleno proveito dos momentos de ternura e expectativa que essa fase proporciona, em vez de se deixar consumir com elevada ansiedade. Quando menos esperar você já estará carregando seu bebê nos braços. Que sua família seja muito abençoada!                                


"
124,"
Reconhecer o que meus pais fizeram por mim


                                    Todos os dias penso nos meus pais e em como posso reconhecer tudo que sempre fizeram por mim. Pai, mãe, vocês são tudo para mim!                                


"
