,0
190,"
Deus, um Pai Preocupado


                                    Infelizmente o Deus estudado pela teologia não corresponde ao Deus interpretado pela psicologia e filosofia. Jesus apresentou um Deus que não condena, não faz guerras para impor sua vontade, não agride, não discrimina, mas um Deus generoso, afetivo, sereno.

Você discrimina prostitutas? Ele as abraça. Você rejeita drogados? Ele os ama. Você dá as costas a muçulmanos ou budistas por não serem cristãos? Ele é deslumbrado por eles. Não importa a opção sexual, a religião, a cultura a nacionalidade. Jesus nos apresentou um pai preocupadíssimo com cada ser humano.

(Augusto Cury)
 


"
191,"
Que Deus continue a lhe dar saúde, querida avó


                                    Hoje que está comemorando mais um ano de vida, querida avó, só quero pedir ao Pai do Céu que continue a lhe dar muita saúde para que possa passar mais tempo junto de quem tanto ama e por quem é tão amada!

Graças a Deus, nunca lhe faltou a saúde e com essa força inesgotável ainda vai viver muitas alegrias. Feliz aniversário, avó querida!                                


"
192,"
Os Melhores Pais do Mundo


                                    Vocês são os maiores! Os melhores pais do mundo! Obrigado por fazerem de mim a pessoa que sou hoje. Mesmo com todas as dificuldades, vocês conseguiram elevar o mais importante que se pode dar a um filho: amor. 

Vocês encheram meu coração de alegria, de paz, de felicidade. Sempre lembrando que o amor é o caminho. O meu maior orgulho reside em vocês. Pai e Mãe – meus ídolos de luta, empenho, força, de bondade! Vocês são o exemplo da verdade da vida. Obrigado por tudo!                                


"
193,"
O furacão de emoções do futuro papai


                                    Futuro papai, do furacão de emoções que você deve estar sentindo, sei que a maior delas é o amor por este bebê que está chegando e que vai transformar completamente sua vida.

Você irá ler muitos livros, assitir vídeos e procurar saber tudo sobre paternidade, mas a verdade é que nada nos prepara para o sentimento de segurar seu bebê no colo pela primeira vez.

Tenho certeza que, apesar dos medos e inseguranças, você será um pai maravilhoso e, no que depender de você, que esta criança terá uma vida muito feliz.

Muitas felicidades para esta família linda e seja bem-vindo ao clube dos papais.                                


"
194,"
Saudades de você, papai


                                    Pai, há tanto tempo você está longe de mim. Sei que a vida tem razões que a razão desconhece, mas o sentimento também nem sempre tem explicação. Mesmo com a ausência e a distância eu amo muito você, papai. 

Eu nunca vou esquecer os momentos felizes que passamos juntos. Você marcou uma das épocas mais felizes da minha vida. Você está presente nas minhas memórias mais remotas e nas lembranças mais felizes.

Pai, espero que um dia possamos voltar a nos reaproximar, espero que um dia você volte a viver mais perto de mim, mas eu quero que você saiba que o meu coração nunca saiu de junto do seu.

Eu te amo e tenho muitas saudades, pai!                                


"
195,"
Todo pai segura a mão dos seus filhos


                                    Você segurou minha mão, me educou e ensinou a ser quem sou. Tenha um feliz e abençoado Dia dos Pais!                                


"
196,"
Que seu bebê traga muita felicidade!


                                    Há nove meses começamos uma contagem regressiva para a chegada da sua filhinha, a cada semana a expectativa era ampliada, mas conseguimos passar por tudo isso e não vemos a hora ver pessoalmente sua linda bebezinha.

Que ela esteja sempre com muita saúde e leve muita alegria para toda família. A chegada de uma nova criança mudará completamente sua maneira de enxergar a vida, mas com certeza a partir de agora ganhará uma enorme bagagem de aprendizado.

Que nunca lhe falta amor e paciência, que consiga superar todas as dificuldades que encontrar pela frente e assim consiga criar sua filha da melhor forma possível, se transformando em um ótimo pai, assim como é um ótimo amigo.

Apesar de ter chegado há tão pouco tempo, meu amor por ela já é imenso! Não vejo a hora de vê-la pessoalmente, para poder abraçar e beijar bastante sua bebezinha! Receba toda minha felicidade pelo nascimento da sua filhinha!                                


"
197,"
Todos os conselhos para um pai de primeira viagem


                                    O dia mais especial da sua vida está prestes a chegar. Falta pouco para você pegar seu bebê no colo pela primeira vez. E não se preocupe, poque mesmo sendo pai de primeira viagem eu sei que você está mais do que preparado para este grande desafio. Parabéns!

O meu único conselho é o seguinte: aproveite todos os instantes, mesmo aqueles mais difíceis que nos levam à exaustão; aqueles que o choro e as birras não conhecem fim. Goze todos os momentos porque seu neném crescerá rápido demais e depois só restará nostalgia.

Prepare-se também para noites sem dormir, horários trocados, descansos apertados. Mas pode ter certeza que tudo isso valerá a pena. Não existirá na sua vida algo tão valioso como seu querido e desejado bebê.

E eu sei que essa criança vai ser muito amada, porque seu coração é de ouro, leve, puro. Divirta-se, tire muitas fotos para mais tarde recordar e seja feliz de um outro jeito. Sim, porque com a chegada de um neném a felicidade ganha uma nova forma; uma nova cor.                                


"
198,"
Estou ao seu lado nesta batalha, pai


                                    Meu coração está com você, pai. Sei que este é um momento delicado, mas tenho certeza que você irá se recuperar.

Dói muito vê-lo doente e fraco, pois sempre lembro de você como se fosse invencível. Você é meu super-herói e sempre será. Estou rezando, mandando boas energias e sei que em breve você estará saudável novamente.

Amo muito você, pai, e estarei do seu lado em todos os momentos desta batalha. Nunca irei desistir de você!                                


"
199,"
Parabéns e muitas felicidades, querido pai


                                    Querido pai, que alegria que você está completando mais um ano de vida. Parabéns e muitas felicidades! De todas as bênçãos que já recebi, ter você como pai é a maior de todas. 

Você é um exemplo de homem, o melhor pai do mundo, meu amigo e meu grande herói. Amo muito você e desejo que seja sempre feliz, e que nunca lhe falte saúde e amor. Feliz aniversário, meu pai!                                


"
200,"
Com amor para melhor pai do mundo

 


                                    Meu querido pai, tudo que sou hoje eu devo a você, não apenas porque foi você quem me deu a vida. Mas principalmente porque me ensinou como a viver e diariamente me inspira com seu exemplo de vida.

E sem dúvida que seu exemplo, suas palavras, seus ensinamentos foram os melhores que alguém pode receber. Por isso, meu pai, todos meus triunfos são seus também; tudo de bom que me acontece é responsabilidade e obra sua também. 

Eu lhe agradeço, meu pai, por tudo que me ensinou, por tudo que fez por mim, por todo amor e carinho que sempre me dedicou. Você é o melhor pai do mundo e eu o amo, respeito e admiro muito!                                


"
201,"
A sua primeira viagem pelo mundo da paternidade


                                    Está prestes a iniciar a sua primeira viagem pelo mundo da paternidade e quero felicitar você pelo grande passo que estará dando brevemente.

Ser pai não é só trazer um filho ao mundo, é proporcionar momentos inesquecíveis e cuidar para que tudo lhe corra bem no futuro. 

Dito isto, tenho a certeza que o seu bebê não podia ter um melhor pai e que os dois irão amar a viagem que irão iniciar juntos. Felicidades!                                


"
202,"
O Grande Amor da Minha Vida


                                    Você é, sempre foi e sempre será o grande amor da minha vida! De todos os sonhos do mundo, ter um filho como você é o mais lindo de todos. E acredite que nada me deixa mais feliz do que ser seu pai! 

Às vezes ainda me perco quando olho nos seus olhos, quando recordo seu peso no meu colo e quando escuto sua voz carinhosa. Você, meu filho, é meu grande orgulho; meu grande amor!                                


"
203,"
Ser padrinho é uma missão muito especial

 


                                    Ser padrinho é estar sempre
à disposição. É estar presente
em todos os momentos especiais
e celebrar cada conquista.

Sou um padrinho abençoado
e todos os dias agradeço pela
oportunidade que me foi dada.

Ser padrinho é ser amigo e pai
ao mesmo tempo. É saber 
relaxar e aproveitar o momento
e ser responsável também.

Sou um padrinho feliz porque
sou padrinho de uma pessoa
incrível e isso é tudo para mim.

Ser padrinho é uma missão
muito especial!                                


"
204,"
A Alegria do Primeiro Bebê


                                    Agora sim, tenho certeza que você está vivendo um dos momentos mais lindos de sua vida! Sua alegria, esse brilho que seus olhos carregam, tudo isso demonstra que você conhece a felicidade faz tempo, mas uma coisa dessa aumenta o sorriso. 

Parabéns! Você vai ser um pai fantástico, moderno e presente! Na verdade, ser pai pela primeira vez pode até assustar no princípio, mas rapidamente o encantamento vira realidade. Aproveite! Felicitações!                                


"
205,"
A Importância do Pai na Vida de um Filho


                                    Ainda vivemos numa cultura onde a importância do pai na vida de um filho, seja qual for o gênero, é menosprezada e diminuída, como se fosse menos essencial ou de menor valia. Esquecemos que já passou o tempo em que a mulher era obrigada a cuidar da família e do lar e para o homem era atribuído o sustento da família e tudo associado ao que estaria fora de casa, participando muito pouco da vida social dos filhos e consequentemente de todos os parentes.

Apesar da mulher ser biologicamente responsável por prover o primeiro alimento do filho, isto não deveria excluir a presença do pai nos momentos decisivos do filho. As leis trabalhistas não ajudam também pelo fato da sociedade ainda não estar convencida que o pai realmente precisa interagir mais na educação dos filhos.

O próprio pai muitas vezes, se dispensa dessa prioridade, achando mesmo que a mãe tem um entendimento já inerente e seu envolvimento só atrapalhará o processo, acreditando que nem é tão importante assim. Embora a mãe esteja associada à questão biológica do processo o pai não deveria nunca se excluir, muito menos pensar que tem menos valor na vida do filho.

Os pais precisam perceber que a educação deve ser vista como um crescimento conjunto da mesma forma que a criança foi concebida. Os filhos têm que receber carinho e afeto dos dois lados e também construir sua personalidade através da percepção de vida tanto do pai quanto da mãe, e esse desenvolvimento não deve acontecer com apenas uma influência e um espectador. Salvo casos excepcionais, se o pai permanecer como uma pessoa dispensável na vida do filho, o tempo só irá fortalecer essa ideia e é muito difícil reverter tudo isso.                                


"
206,"
Força e rápidas melhoras, meu amado pai


                                    Meu pai, não imagina como está sendo difícil e doloroso ver como está debilitado pela doença e não poder fazer nada. Cresci com a ideia de que você é um super-homem, que não existe nada que consiga derrubar você, mas é claro que é apenas humano. 

Mas seja como for, você não é um humano qualquer, não é um homem comum. Você é muito mais, especial e único, você é o meu herói e eu sei que conseguirá superar essa doença, e que sairá fortalecido de toda esta situação. Força e rápidas melhoras, meu amado pai!                                


"
207,"
Parabéns pelo novo bebê, papai


                                    Parabéns, papai! Parece que a família vai aumentar e eu não poderia estar mais feliz por você! Tenho certeza que vai ser muito especial viver todas essas aventuras de novo.

Espero que você e sua família sejam muito felizes nessa nova etapa e sei que isso unirá vocês ainda mais então aproveitem cada segundo. Parabéns pelo novo bebê!                                


"
208,"
Saudades do meu falecido pai


                                    Trago comigo uma saudade que não desaparece por nada e que tem o nome do meu falecido pai.                                


"
209,"
Ao meu pai, que sempre me ensinou tanto


                                    Você me ensinou tudo que eu sei, pai, e sempre foi o meu maior exemplo. Hoje, quero agradecer por tudo que fez por mim e por tudo que ainda faz.

Eu sei que você não é um pai perfeito, porque a perfeição não existe. Sei também que sempre se esforçou ao máximo para me dar a melhor vida que poderia e é isso que importa.

Minha gratidão e meu amor por você são eternos, pai. Obrigada por ter sempre me mostrado o melhor caminho a seguir. Você é o melhor pai que eu poderia ter.

Amo você com todo meu coração!                                


"
210,"
A Dor Que Dói Mais


                                    Trancar o dedo numa porta dói. Bater com o queixo no chão dói. Torcer o tornozelo dói. Um tapa, um soco, um pontapé, dóem. Dói bater a cabeça na quina da mesa, dói morder a língua, dói cólica, cárie e pedra no rim. Mas o que mais dói é saudade.
Saudade de um irmão que mora longe. Saudade de uma cachoeira da infância. Saudade do gosto de uma fruta que não se encontra mais. Saudade do pai que já morreu. Saudade de um amigo imaginário que nunca existiu. Saudade de uma cidade. Saudade da gente mesmo, quando se tinha mais audácia e menos cabelos brancos. Dóem essas saudades todas. 
Mas a saudade mais dolorida é a saudade de quem se ama. Saudade da pele, do cheiro, dos beijos. Saudade da presença, e até da ausência consentida. Você podia ficar na sala e ele no quarto, sem se verem, mas sabiam-se lá. Você podia ir para o aeroporto e ele para o dentista, mas sabiam-se onde. Você podia ficar o dia sem vê-lo, ele o dia sem vê-la, mas sabiam-se amanhã. Mas quando o amor de um acaba, ao outro sobra uma saudade que ninguém sabe como deter.

Saudade é não saber. Não saber mais se ele continua se gripando no inverno. Não saber mais se ela continua clareando o cabelo. Não saber se ele ainda usa a camisa que você deu. Não saber se ela foi na consulta com o dermatologista como prometeu. Não saber se ele tem comido frango de padaria, se ela tem assistido as aulas de inglês, se ele aprendeu a entrar na Internet, se ela aprendeu a estacionar entre dois carros, se ele continua fumando Carlton, se ela continua preferindo Pepsi, se ele continua sorrindo, se ela continua dançando, se ele continua pescando, se ela continua lhe amando.

Saudade é não saber. Não saber o que fazer com os dias que ficaram mais compridos, não saber como encontrar tarefas que lhe cessem o pensamento, não saber como frear as lágrimas diante de uma música, não saber como vencer a dor de um silêncio que nada preenche.

Saudade é não querer saber. Não querer saber se ele está com outra, se ela está feliz, se ele está mais magro, se ela está mais bela. Saudade é nunca mais querer saber de quem se ama, e ainda assim, doer.

(Martha Medeiros)                                


"
211,"
O meu pai faz de mim uma filha feliz


                                    Pai, eu sei que posso sempre contar com sua proteção, com seu amor e coração. Felizmente, sou a filha mais feliz que existe neste mundo, eu tenho certeza. 

Às vezes ainda fico me recordando dos tempos de criança em que sua mão segurava a minha e juntos sorriamos enquanto brincávamos. Agora, não sou tão criança, mas a sua mão continua amparando a minha.

Sinto que essa segurança que você me dá é responsável pelo meu bem-estar, pela confiança que sinto aqui ou em qualquer lugar. Você não é só um pai para mim: é uma inspiração.                                


"
212,"
Pai, Eu te Amo


                                    Você é o pai que todo mundo gostaria de ter na vida. Sinto que na sua companhia nada pode acontecer de errado! Na verdade, quando o amor é verdadeiro como o nosso tudo se torna possível! 

E esse amor é antigo; nasceu quando eu nasci e se tornou maior a cada novo dia ao seu lado. Você me ensinou coisas que jamais vou esquecer e me transformou no que eu tanto quis ser. 

Juntos carregamos no coração o sentimento mais forte e mais puro que existe. Prometo te amar incondicionalmente. Te adoro, meu pai!                                


"
213,"
Volte Logo, Já Sinto Sua Falta


                                    Até breve, meu pai! Você ainda nem foi e eu já estou morrendo de saudade. Não vai ser fácil acordar pela manhã e saber que não tenho seu abraço ou que não vou poder olhar em seu rosto, mas a vida é feita de opções, de surpresas e novidades. 

É por isso isso que tenho certeza que essa sua viagem vai ser muito importante para todos. Volte logo, pai! Boa viagem!                                


"
214,"
Ao papai mais incrível do mundo


                                    Espero que esta cartinha possa transmitir todo amor que sinto por você, papai. Hoje, quero agradecer pelo pai especial que tenho, que está sempre ao meu lado, garantindo o meu futuro.

Você sabe, papai, que aprecio cada esforço que você faz comigo, e até entendo, quando você chega mais tarde por estar trabalhando para que eu tenha todo o conforto que preciso.

Espero que um dia, eu possa ser exatamente como você.

Te amo, papai!                                


"
215,"
As saudades do meu pai









Meu pai, sinto tanto a sua falta que às vezes parece que a saudade já não cabe no meu peito.                                    


"
216,"
O que sinto por você, meu pai









Por você sinto admiração, respeito e muito amor, pois você é o melhor pai do mundo!                                    


"
217,"
Ser pai adotivo é amar, cuidar e proteger


                                    Sempre me emociono pensando em toda nossa história. Ser um pai adotivo é sentir um amor que eu nunca imaginei que seria possível.

Eu não me apaixonei pelo meu bebê quando ele saiu da barriga da minha esposa, mas senti um amor inexplicável quando o peguei nos braços pela primeira vez. Foram tantas emoções que vivemos juntos e que guardo no fundo do coração.

Eu sou pai e o resto não interessa. Amo minha criança como se fosse minha, porque, na verdade, ela é. Eu a criei e estarei aqui em todos os momentos da sua vida, amando, cuidando e protegendo, pois é isso que um pai faz!                                


"
218,"
Uma família perfeita


                                    Faço parte da vida daqueles que têm 
amigos, pois ter amigos é ser feliz.

Faço parte da vida daqueles que vivem 
cercados por pessoas como você, 
pois viver assim é ser feliz!

Faço parte da vida daqueles que 
acreditam que ontem é passado, 
amanhã é futuro e hoje é uma dádiva,
por isso chamado de presente.

Faço parte da vida daqueles que acreditam 
na força do amor, que acreditam que para 
uma história bonita não há ponto final.

Eu sou casada sabiam?
Sou casada com o Tempo.
Ah! O meu marido é lindo!
Ele é responsável pela resolução
de todos os problemas.

Ele reconstrói corações, 
cura machucados,
e vence a Tristeza.

Juntos, eu e o Tempo, tivemos três filhos:
A Amizade, a Sabedoria, e o Amor.
A Amizade é a filha mais velha.
Uma menina linda, sincera, alegre.
A Amizade brilha como o sol.
A Amizade une pessoas,
pretende nunca ferir, sempre consolar.

A do meio é a Sabedoria, culta, íntegra, 
sempre foi mais apegada ao Pai, o Tempo.
A Sabedoria e o Tempo andam sempre juntos!
O caçula é o Amor.
Ah! Como esse me dá trabalho! É teimoso, 
às vezes só quer morar em um lugar...

Eu vivo dizendo: Amor, você foi feito 
para morar em dois corações, não 
em apenas um. O Amor é complexo,
mas é lindo, muito lindo! Quando ele 
começa a fazer estragos eu chamo logo 
o seu pai, o Tempo, e aí o Tempo sai 
fechando todas as feridas que o Amor abriu!

Uma pessoa muito importante 
me ensinou uma coisa: Tudo no final 
sempre dá certo. Se ainda não deu 
é porque não chegou o final.
Por isso, acredite sempre na minha família.

Acredite no Tempo, na Amizade,
na Sabedoria e, principalmente no Amor.
Aí, com certeza, um dia, eu, a Felicidade,
baterei à sua porta!
Tenha Tempo para os Sonhos.
Eles conduzem sua carruagem 
para as Estrelas. Tenha um ótimo dia! 
E não se esqueça: Sorria!                                


"
219,"
A Viagem de um Pai de Verdade


                                    Todo homem que é pai de verdade é também um cuidador, um ser humano incrível que luta até à última gota de suor para garantir a felicidade do seu filho. Ser pai é dar amor, atenção, carinho e educação. 

Quando um pai olha seu filho ele sente a vida, ele enxerga a razão de existir e se sente feliz. Todo pai, todo pai de verdade chora perante a dificuldade mas não desiste e vence qualquer infelicidade. Ser pai é viver para guiar seu filho e ao seu lado partir em uma viagem linda e emocionante.                                


"
220,"
Você existe mesmo, papai


                                    Pai,

Você é mesmo de verdade? Eu sou bebê e às vezes ainda duvido do que sinto e penso, do que é ou não realidade. Você é tão incrível e maravilhoso que nem parece uma pessoa como todas as outras. Por favor, nunca mude, papai!

Este amor que sinto por você é absolutamente sincero e incondicional. Faça o que fizer, cometa os erros que cometer, eu lhe prometo que estarei sempre junto. Aliás, nem conseguiria que fosse de outra forma. O que a vida une, jamais poderá ser separado. Papai, eu amo você!                                


"
221,"
Pode acreditar, você será um pai incrível


                                    Respire fundo, tenha calma e confie em você mesmo. Chegou a hora de mostrar que tipo de homem você realmente é e passar para frente todas as suas qualidades. A viagem de ser pai está começando e - pode acreditar - vai ser incrível!

Sei que o nervosismo está batendo, mas não se deixe levar pela histórias sobre noites mal dormidas, você sabe que no final não há sacrifício grande suficiente por este bebê que agora reina no seu coração.

Você é um homem e tanto e agora também vai ser um pai maravilhoso. Parabéns por esta fase linda que está começando na sua vida!                                


"
222,"
Um pai faz mais do que gerar vida


                                    Um pai de verdade faz mais do que gerar vida; ele educa, ama e guia seu filho ao longo de toda sua vida.                                


"
223,"
Aniversário de meu casamento com um marido exemplar


                                    São muitos os motivos que tenho para celebrar. Hoje completamos juntos mais um aniversário de nosso casamento. Mas também lembramos o amor que ainda nos une, e o desejo de continuarmos lado a lado até que a morte nos separe.

Você é um marido maravilhoso, bom pai, amigo e companheiro. Tenho muita sorte em tê-lo na minha vida dia após dia. Obrigada por tudo que me dá e por fazer de mim a mulher mais feliz do mundo!                                


"
224,"
O que nos une é o amor, padrasto


                                    O que nos une é o amor. E quando o assunto é o relacionamento humano só isso importa de verdade. Não interessa se o sangue é o mesmo. O que interessa é o afeto, o carinho, o amor. E isso faz de você algo mais do que um simples padrasto; isso faz de você meu pai!

Sou uma pessoa abençoada por ter ao meu lado pessoas incríveis e donas de corações deslumbrantes e atitudes memoráveis. Todos os dias aprendo algo novo com você! E isso não tem preço. Gosto muito de você e sempre irei gostar!

Desejo que a vida seja sempre sua grande aliada, sua amiga para todas as horas. Você merece experimentar a alegria todos os dias e nunca descobrir o cansaço ou a infelicidade. Pessoas como você são raras! Nunca mude, seja sempre assim maravilhoso!                                


"
225,"
Espero vir a ser um pai fantástico como você


                                    Não sei quando irei ter filhos, mas quando tiver, espero conseguir ser um pai tão fantástico como você tem sido para mim!                                


"
226,"
Um avô é uma bênção muito especial


                                    Você é um segundo pai para mim, querido avô. Nossos anos de diferença podem ser muito grandes e termos formas de pensar que não são iguais, mas nada disso impediu que nos uníssemos e criássemos esta linda relação de companheirismo.

Todos os dias agradeço a Deus a oportunidade de ter pessoas como você na minha vida, que me ensinam muitas coisas e me inspiram a lutar pelas coisas em que acredito. Quanto mais o tempo passa, mais você se torna uma verdadeira bênção para mim!                                


"
