,0
0,"
O meu exemplo de vida é meu pai
Pai, o meu exemplo de vida és tu por tudo que representas para mim. Eu te amo!

"
1,"
Meu sogro e segundo pai, Feliz Dia dos Pais
A vida me ofereceu um segundo pai. Querido sogro, tenha um dia dos pais mega feliz, incrivelmente belo, único. Você sabe que o sentimento que nos une é simplesmente maravilhoso. 

E é também por isso que torço para que a jornada de hoje fique guardada na sua memória por todas as melhores razões. Você está sempre perto, sabe como me ajudar, dar apoio, ensinar. 

Pai é também aquele que mesmo não compartilhando o sangue consegue se multiplicar para compartilhar amor. Pessoas como você merecem tudo que existe de bom neste mundo. 

Meu sogro, seja sempre feliz!
Feliz Dia dos Pais!

"
2,"
Meu sogro é um pai emprestado
Um sogro de verdade é como um pai que nós pegamos emprestado de vez em quando.

"
3,"

Meu sogro, um exemplo de pai

 

                    Feliz dia dos pais, querido sogro! Você é um dos melhores exemplos que eu já conheci na vida do que é ser um grande pai e um exemplo de homem.

O mérito de um pai se reflete nos seus filhos, e no seu caso tal verdade vive na pessoa que eu tanto amo e com quem compartilho a minha vida, e por isso também lhe devo um agradecimento.

Espero que hoje receba as merecidas homenagens com muita alegria no seu coração, pois você é um grande homem e um grande pai!                

"
4,"
Pai, Meu Grande Exemplo
Quem disse
que por detrás daquela barba
que nos arranha o rosto
não tem um coração de moleque
querendo brincar?

Quem disse
que por detrás daquela 
voz grossa não tem um 
menino criativo querendo falar?

Quem foi que falou
que aquelas mãos grandes
não sabem fazer carinho 
se o filho chorar?

Quem foi que pensou,
que aqueles pés enormes,
não deslizam suaves 
na calada da noite,
para o sono do filho velar?

Quem é que achou
que no fundo do peito largo e viril
não tem um coração de pudim,
quando o filho amado, com um 
sorriso largo se põe a chamar?

Quem foi que determinou
que aquele coroa de cabelos 
brancos não sabe da vida
para querer me ensinar?

Pai, você me escolheu como filho, 
e eu fiz de você meu exemplo! 
Feliz Dia dos Pais, meu PAI!

"
5,"
Meu padrinho também é um exemplo de pai e de fé
Meu padrinho querido, feliz Dia dos Pais! Você também é pai e não poderia deixar esta data passar sem lhe dar os parabéns! Deus foi bom comigo quando lhe colocou no meu caminho!

Você é um exemplo muito bonito para todos homens que pretendem ser o que seus filhos precisam para serem pessoas de bem. Deus fez de você um padrinho sem igual e um orgulho de ter na minha vida.

Tenha um ótimo dia e espero que seja tudo que você merece que seja! Parabéns e um grande abraço!

"
6,Parabéns para mim: dicas para celebrar o meu aniversário
7,Mundo das Mensagens
8,50 frases de aniversário para pai que vão deixar o dia dele mais feliz
