,0
0,"
Uma colega querida e amiga


                                    Nunca pensei que pudesse vir a encontrar, em meu local de trabalho, uma pessoa tão especial que se tornaria minha amiga. Você foi desde o início uma boa companheira, sempre preocupada em ajudar no que fosse necessário. Nos momentos mais difíceis você sempre esteve presente e eu jamais poderei esquecer tudo o que você fez por mim.

Muito obrigada querida colega e amiga! 


"
1,"
Obrigada, meus amados pais


                                    Meus pais, vocês me deram a vida, vocês são a minha vida, eu sou parte de vocês, e vocês estão em mim. Não há palavra no mundo capaz de expressar o amor que sinto por vocês. Vocês foram sempre pais impecáveis, companheiros, amorosos e seres humanos inspiradores. O amor de vocês me inspira, a postura de vocês em relação ao mundo me inspira, e até quando acho que vocês não agiram bem não consigo deixar de admirá-los.

Eu sou muito grata a Deus por ter escolhido vocês para me receberem na terra e me ensinarem tudo que eu precisava aprender para seguir o meu caminho e cumprir a minha missão na vida. Eu me sinto extremamente abençoada por ter nascido no leito de uma família tão unida e cordial, pacífica e compreensiva. Se todas as famílias no mundo fossem como a nossa, não haveria razão para duvidar desta instituição maravilhosa que é a família, lugar onde aprendemos a ser nós mesmos e a enfrentar o mundo e a vida.

Eu agradeço profundamente o amor que vocês me ensinaram a sentir e a paixão com que me mostraram a vida. Sou feliz porque aprendi a ser feliz com vocês. Amo muito vocês, meus pais queridos!                                


"
2,"
Agradeço a Deus por tudo que vivi nesse ano


                                    Mais um ano passou
E a vida parece continuar,
Entre o que fui e o que sou
Há muito de bom para recordar.

Ano após ano vou amadurecendo
Em cada batalha, vitória ou decepção
E minha fé acaba se fortalecendo,
Cada dia é uma prova de superação.

Agradeço a Deus de coração
Por tudo que neste ano pude viver,
Por ter sido meu Pai, minha proteção,
A força que às vezes parecia não ter.

Que eu possa desfrutar de muitos anos
Ao lado das minhas pessoas amadas,
Que se concretizem meus sonhos e planos
E a vida vire um conto de fadas.                                


"
3,"
Agradeço pela mãe incrível que você é


                                    Minha mãe é um anjo que Deus enviou para me cuidar. Não tenho palavras para agradecer tudo que você já fez por mim.

Aprendi muito observando seu jeito de ser e admiro muito a mulher forte e incrível que você é. Sei que hoje sou quem sou por sua causa e se estou bem hoje devo isso a você.

Agradeço pelos ensinamentos, pelo carinho, pela paciência e por me aguentar há tantos anos, mãe. Sei que tenho uma sorte enorme por ser filha de uma pessoa tão especial. Amo você, mãe!                                


"
4,"
Jamais teria chegado aqui sem vocês


                                    Este é um momento muito importante para mim. Hoje entrego minha monografia e inicio uma nova etapa de vida.

Nada disso teria sido possível se não fosse por Deus, que iluminou meu caminho ao longo desta jornada.

Quero agradecer, também, esta instituição de ensino que me proporcionou momentos e ensinamentos que levarei comigo para sempre. Aos meus professores e professoras, deixo também meu agradecimento por tudo que aprendi com vocês.

Agradeço à minha família, que sempre me incentivou e garantiu que eu não desistisse nunca. 

Aos meus amigos deixo aqui minha gratidão, pois foram eles que fizeram com que eu seguisse sempre de cabeça erguida.

Agradeço a todos que fizeram parte desta caminhada ao meu lado.

Que venha o futuro!                                


"
5,"
Este trabalho é fruto de muita dedicação


                                    Sinto que sou uma pessoa de sorte que pude contar com o apoio de muitas pessoas para realizar meu maior sonho.

Esta monografia é fruto de muito trabalho e dedicação que não seriam possíveis sem a fé que tenho em Deus. 

Agradeço a esta Universidade, meus professores por me capacitarem para a realização deste trabalho.

Agradeço minha família e amigos que me deram força e coragem.

Obrigado!                                


"
6,"
Um presente no momento certo


                                    Querida amiga,

O seu presente chegou no momento certo! Ele trouxe muita alegria para mim por ser tão lindo mas, acima de tudo, por demonstrar a consideração e o carinho que você tem por mim.

É uma grande felicidade ter uma amiga como você em minha vida. Você é uma pessoa especial com um coração generoso e eu quero que a nossa amizade permaneça eternamente. 


"
7,"
Agradeça pela sua vida


                                    Você não pode ver o futuro. Você não pode ver o que lhe vai acontecer hoje e nem amanhã. Mas você pode olhar para trás, olhar para os anos que passaram, e para tudo que lhe aconteceu, desde as pequenas coisas até os grandes acontecimentos. Pode ser que fique absolutamente perplexo se prestar atenção à quantidade de coisas que você já viveu e aprendeu.

Tudo que aconteceu em sua vida pode ter lhe trazido grandes aprendizados, e pode fazer o seu presente e o seu futuro serem maravilhosos. Se você prestar atenção, vai perceber que tudo que aconteceu teve uma razão de ser, e você vai compreender também que é preciso agradecer até mesmo pelas coisas que você desejava e que não deram certo. 

Agradeça pela sua vida, e aconteça o que acontecer, continue sempre sonhando. Orgulhe-se da sua história, das suas experiências e transforme tudo que viveu em ações positivas para o seu futuro e para o seu presente!                                


"
8,"
Um agradecimento a quem meu ajudou neste percurso


                                    A meta foi alcançada, o sonho foi cumprido, mas até tudo se tornar realidade houve um longo percurso onde várias pessoas se tornaram fundamentais.

A Deus agradeço por ter guiado meus passos na direção certa. Sem Ele não teria forças para concluir este objetivo e foram muitas as vezes em que senti sua mão protetora quando tudo parecia estar desabando.

À instituição onde aprendi tudo que sei e que me permitiu que me desenvolvesse enquanto pessoa. Adquiri ferramentas muito importantes, mas também valores humanos que vou levar para toda vida. Um agradecimento especial às pessoas que representam tão bem essa mesma instituição, especialmente às que me acompanharam de perto: diretor, coordenador e restantes professores.

Por último, mas não menos importante, um agradecimento à minha família que me apoiou incansavelmente e participou ativamente para que eu continuasse determinado em alcançar esta meta. Também meus amigos e colegas que viveram esta experiência comigo ficarão eternamente no meu coração.

Todas as palavras de gratidão parecessem escassas porque não expressam o verdadeiro significado que vocês tiveram para mim neste percurso. Esta vitória é também a vitória de todos vocês.                                


"
9,"
A hora de distribuir agradecimentos


                                    O Senhor Todo Poderoso esteve ao meu lado ao longo de todo este percurso e me deu força e fé para continuar. A Ele eu agradeço.

À instituição que me acolheu e deu todas as chances, eu devo minha profunda gratidão. Foi graças aos recursos e condições maravilhosas que eu me senti em casa, mesmo nas horas de maior dificuldade.

A todos os professores que me orientaram, indicaram o melhor caminho e acreditaram nas minhas capacidades, eu quero deixar meu agradecimento. Vocês foram incríveis para mim!

A minha família, onde incluo também meus amigos, foi o pilar para tudo ter dado certo. Eu sei que nem sempre foi fácil, mas com pessoas como vocês, tudo se torna mais fácil.

Se me esqueci de alguém, eu peço desculpa. A verdade é que me sinto tão feliz que neste momento agradeceria até a quem um dia me provocou e fez mal. Na verdade, até essas pessoas me ajudaram a crescer.  


"
10,"
Quero agradecer por tudo


                                    Meu anjo, quero agradecer 
A você por tudo! 
Pelos momentos em que chorei, 
Você veio carinhosamente 
Me beijou e me fez sorrir.
Pelos momentos em que perdi 
A paciência, você veio com 
Palavras amenas e doces 
E me acalmou.

Pelos momentos em que 
Meu coração estava em pedaços, 
Você veio cheio de amor e me curou.
Pelos momentos de alegria 
Que fez questão de dividir comigo.
Pelos momentos que com muita 
Esperança, pensou junto comigo 
No nosso futuro.

Obrigada, meu amor! Obrigada
Por existir na minha vida! 
Obrigada por me fazer feliz e a 
Pessoa mais amada na sua vida!
Eu te amo!                                


"
11,"
Agradeça a Bênção


                                    Agradeça a doce bênção
Que é o seu viver
Agradeça de coração
A existência do seu ser.

Cultive sempre um sorriso
Nem pense em desanimar
Ter fé em Deus é preciso
Para sua luta ganhar!                                


"
12,"
Agradecimento a Deus pela minha formatura


                                    Sempre que cumprimos nossos objetivos merecemos ser aplaudidos, mas nunca podemos nos esquecer de dar louvor a quem nos deu oportunidade de vencermos. Por isso, hoje quero Te agradecer muito, meu Deus, pela formatura e por ter conseguido alcançar a meta que tanto sonhei!

Todas as minhas vitórias serão sempre Tuas também, pois a força que me faz lutar e persistir provém apenas do Teu poder, meu Pai Celestial.                                


"
13,"
Obrigada pela amizade de sempre


                                    Os amigos de verdade se revelam, não nos momentos felizes e fáceis da vida, mas sim nos momentos mais difíceis, nos momentos em que não temos um sorriso no rosto, mas sim lágrimas. Os amigos de verdade, se revelam quando precisamos de um ombro amigo e um colo para nos abrigar.

Nesta fase tão complicada da minha vida vi muitos amigos se afastarem, mas os que ficaram sei reconhecer que são os meus amigos de verdade, e eu agradeço muito por isso. Agradeço por terem ficado ao meu lado, agradeço por terem entendido o meu momento, as minhas fraquezas, a minha instabilidade e a minha indisposição. 

Agora que a nuvem negra que pairava sobre mim passou, reconheço mais do que nunca a importância que cada um de vocês teve. Sem vocês eu não teria conseguido prosseguir, vocês foram a minha força, vocês me deram coragem para seguir em frente. 

Fico feliz e aliviada em saber que neste mundo, onde há tanta gente egoísta, há também muitas pessoas em quem podemos confiar e com quem podemos contar. Obrigada pela amizade incondicional de vocês! O que posso fazer é dizer que eu também estou aqui para o que der e vier. Contem comigo! Amo muito vocês!                                


"
14,"
Um Agradecimento Especial de TCC


                                    Esta fase da minha vida é muito especial e não posso deixar de agradecer a Deus por toda força, ânimo e coragem que me ofereceu para ter alcançado minha meta.

À Universidade quero deixar uma palavra de gratidão por ter me recebido de braços abertos e com todas as condições que me proporcionaram dias de aprendizagem muito ricos.

Aos professores reconheço um esforço gigante com muita paciência e sabedoria. Foram eles que me deram recursos e ferramentas para evoluir um pouco mais todos os dias.

É claro que não posso esquecer da minha família e amigos, porque foram eles que me incentivaram e inspiraram através de gestos e palavras a superar todas as dificuldades.

A todas as pessoas que de uma alguma forma me ajudaram a acreditar em mim eu quero deixar um agradecimento eterno, porque sem elas não teria sido possível                                


"
15,"
Vou agarrar esta oportunidade


                                    Nesta vida onde as chances são tão escassas, temos que aproveitar cada porta que se abre para nós. É esse o meu lema desde que entrei para esta empresa e certamente é assim que vou continuar a encarar meu trabalho.

Quero agradecer de todo o coração, estimado chefe, pela promoção que você me deu. Agora terei a oportunidade de mostrar o meu empenho de uma forma mais significativa e eu não vou querer desiludir você. 


"
16,"
A Sexta-feira Santa é um momento sagrado


                                    Hoje quero orar em agradecimento a Jesus que se sacrificou para que nós pudéssemos viver. Para mim, este é um momento sagrado e devemos sempre honrar este dia.

Nunca podemos esquecer o verdadeiro significado da Sexta-feira Santa e devemos sempre garantir que a vida do nosso Senhor seja um exemplo para todos nós.

Estejamos juntos em oração neste dia especial e vamos agradecer por tudo que temos. Que Deus abençoe todos nós.                                


"
17,"
Seu Prêmio, Mãe


                                    Se existisse uma premiação para melhor mãe adotiva, você ganharia com toda certeza. É um sonho tornado realidade, sabe? Ser sua filha é a maior dádiva que a vida me ofereceu, mãe! 

Você sempre demonstrou amor e carinho, sempre dignificou a educação através de seus sábios ensinamentos. É incrível como meu coração foi facilmente conquistado por você. 

Apesar de todas dificuldades, de todas as contrariedades, você nunca desistiu de mim. Meu prêmio para você é seu nome em meu coração!                                


"
18,"
Agradeço muito sua preciosa amizade


                                    Uma amizade como a sua é uma bênção vinda de Deus. É maravilhoso ter alguém ao nosso lado em todos os momentos, uma amiga capaz de me dar conforto nos piores momentos e companhia para viver as melhores aventuras.

Quero agradecer muito por ser uma pessoa especial que eu quero na minha vida para sempre. Que nenhuma circunstância jamais leve você para longe de mim!                                


"
19,"
Parabéns, soldados corajosos


                                    Neste dia do soldado, quero deixar aqui minha homenagem e meu agradecimento a estes homens de honra. Vocês carregam a coragem, a força e a determinação.

Parabéns pelo dia e sigam o bom trabalho!                                


"
20,"
Obrigada por ser minha amiga 


                                    Obrigada por você ser minha amiga. É bem verdade que nos momentos inesperados, surgem acasos surpreendentes. O sentimento que hoje nutrimos uma pela outra é um desses casos.

Toda verdade que você tem para mim, tudo que você me dá não tem preço. 
Agradeço à vida por me ter oferecido sua amizade. 
A você, querida amiga – estarei sempre grata e pronta para tudo.                                


"
21,"
Estou aqui para agradecer


                                    Estou aqui para agradecer a você:
sua simpatia por se lembrar de mim
sua dedicação e sua fidelidade.

Sua gentileza ao enviar-me coisas
tão bonitas que tocam meu coração.
Agradeço as mensagens e cartões!

Sabe, tudo que é bom dura o tempo
suficiente para se tornar inesquecível,
e isso você é: Inesquecível!                                


"
22,"
Até uma próxima visita, estimado cliente


                                    Agradecemos muito a oportunidade que nos deu de entrarmos na sua vida. Nossa missão é ir sempre de encontro às expectativas dos nossos clientes e é para isso que trabalhamos incansavelmente dia após dia.

Foi um prazer receber sua visita. Esperamos que tenha gostado e que a qualidade do nosso trabalho justifique uma próxima visita.                                


"
23,"
Obrigado Por Estar Aqui


                                    Todos passamos por momentos difíceis, e é nesses momentos que descobrimos a nossa força e quem são nossos verdadeiros amigos, quais são as pessoas que realmente se importam conosco.

Durante meu pior momento até hoje, eu descobri muito sobre mim e quem me rodeia, e tive a certeza daquilo que já sabia, que você é uma pessoa maravilhosa e que realmente é minha amiga. 

Hoje eu quero agradecer, apesar de saber que você não ficou do meu lado, me apoiando dia e noite, todos os dias, para no final receber um agradecimento, para ser reconhecida. Mas eu quero agradecer, e vou agradecer eternamente, pois lhe devo muito e além da minha amizade não tenho outra forma de recompensar você. 

Você é maravilhosa, a melhor amiga que alguém pode desejar. Obrigada, minha amiga, obrigada por ter estado e por estar sempre aqui! Adoro você!                                


"
24,"
Boa Tarde Querido Amigo


                                    Nunca é tarde para concretizarmos nossos sonhos. O tempo vai passando e por vezes ficamos presos em nossos receios e hesitações. Quando nos apercebemos, as oportunidades já pairam apenas no horizonte e correr atrás delas será uma luta em vão. Mas em nossa vida de múltiplas escolhas, nunca se esgotam nossas possibilidades. Basta prestarmos atenção ao mundo que nos rodeia, escutarmos nosso coração e seguirmos a tal intuição.

Meu querido amigo, eu sei que você triunfará em seu caminho. Você é alguém atento ao que acontece à sua volta e por isso é que sempre esteve presente em meus melhores e piores momentos. Quero demonstrar minha gratidão por estar também sempre de seu lado. E nada te vai impedir de conquistar à tão desejada e merecida felicidade. Ela está muito perto de você, basta apenas nunca deixar de acreditar.

Uma excelente tarde, meu amigo e companheiro! 


"
25,"
Obrigado pela amizade, meu amigo

 


                                    Poucos são os que se podem orgulhar e alegrar por, na sua vida, possuírem uma amizade verdadeira e de tantos anos quanto a nossa. Por todos esses anos, e pelo inestimável sentimento que nos une, eu lhe agradeço de coração, meu amigo!

São muitos momentos colecionados, alegrias compartilhadas, tristezas divididas.
Obrigado por tudo, amigo! É uma alegria e um conforto incomparáveis ter você sempre presente em minha vida.                                


"
26,"
Agradecimento a Deus pelo batizado


                                    Meu Deus, hoje nossos corações transbordam alegria e gratidão por todas as bênçãos que nos tens dado. 

Agora que vamos consagrar nosso bebê à Tua proteção através do sacramento do batismo, agradecemos a Tua generosidade. 

Mas também pedimos, meu Deus, que cuides, orientes e protejas nosso bebê por toda sua vida. Entregamos nas Tuas mãos a sua alma, mas também a felicidade de todos nós. 

Nós Te agradecemos, Senhor, pela Tua infinita generosidade e misericórdia!                                


"
27,"
Agradecimento a um Deus de amor e bondade

 


                                    Se hoje estou vivo e em condições de poder desfrutar de mais um dia, devo tudo isso a Deus, um Pai amoroso que sabe cuidar de todos aqueles que se esforçam em fazer a sua vontade.

Agradeço de todo pela misericórdia e a bondade com que me tratas, meu Deus. Não há nada melhor que seguir Teus caminhos e poder sentir que esse é o melhor modo de vida que existe. 


"
28,"
Obrigada por tudo, minha amiga


                                    Os amigos de verdade se revelam nos momentos difíceis da vida, naqueles momentos em que realmente precisamos deles perto de nós, naqueles momentos que não são propriamente felizes, nem de alegria. Nas situações complicadas da vida, aqueles que vemos por perto, que estão ao nosso lado, são realmente os nossos amigos.

Eu tenho muito o que agradecer a você. Agradeço pela sua amizade, pelo seu apoio incondicional, pelo seu esforço em me fazer sentir bem, e em me fazer acreditar que tudo isso vai passar e eu vou voltar a ser feliz. Muito obrigada por ser tão amiga, por ser a minha melhor amiga, por ser a minha irmã de alma e estar comigo neste momento tão complicado. 

Os amigos realmente são os anjos que Deus coloca na nossa vida, e você é o meu anjinho especial.

Te adoro minha amiga!                                


"
29,"
Obrigada por Existir


                                    Quando eu já não tinha 
Mais para onde ir
Você me mostrou o caminho.
Quando os problemas da vida 
Me deixaram triste
Você me fez sorrir.
E agora graças a você
Já tenho para onde ir,
Não sei o que é chorar,
Vivo intensamente cada momento,
E quero sempre viver 
Com você ao meu lado!
Obrigada por existir na minha vida 
E me fazer tão feliz!                                


"
30,"
O prazer de fazer parte desta família


                                    A cada dia que passa, cresce o meu sentimento de gratidão por você. Suas atitudes generosas e palavras simpáticas fazem com que eu me sinta mais familiarizada com todos e isso é muito importante para mim.

Quero corresponder da melhor forma e ser uma companhia igualmente agradável para vocês. É uma grande honra poder fazer parte desta querida família. 


"
31,"
O incentivo que recebi


                                    Foi graças a todo incentivo que recebi durante estes anos que hoje posso celebrar este marco na minha vida: a minha formatura. Um agradecimento a todos!                                


"
32,"
Um Brinde à Vida


                                    A todas as vozes que desaprenderam preces, ou mesmo que jamais aprenderam. A todas as solidões individuais ou compartilhadas, gritadas, colhidas ou caladas, nos corações e nas almas. 

A todas as buscas que levaram a encontros, perdas ou abandonos. A todos os silêncios de gestos e palavras que encobriram impossibilidade, refúgios, medos ou ausências. E, principalmente, àqueles que disseram mais do que palavras.

A todos os braços e abraços que acolheram, aqueceram e ampararam, nos momentos em que a perda já parecia certa e o abandono das forças de luta era aparentemente a única possibilidade de resposta.

Aos sorrisos esboçados ou assumidos que coloriram os rostos e enfeitaram o mundo. A todas as crianças crescidas e pequenas que viveram momentos de descoberta e não morreram para o aprender.

A todo o Amor que nasceu e morreu, mas que teve seu espaço de cor, força e brilho nas faces, corações e corpos. A todas as músicas e versos que os artistas, ou não, exprimiram com suas emoções e nos ajudaram a compreender e comunicar melhor as nossas.

A toda voz ou carícia que não se negou, que ouviu o apelo e respondeu com sua existência, sua expressão sua proximidade. A todas as orações desesperadas, suplicantes ou agradecidas. A todos os “becos sem saída” que deram em novos caminhos e em outras possibilidades.

A todos os desesperados que tiveram a grandeza de pedir ajuda e dar a enorme descoberta de serem conhecidos na partilha e no calor de um olhar, talvez perplexo, mas acolhedor.

A toda a vida que se omitiu ou ousou, que se transformou ou paralisou no tempo do medo. A todo o medo que a coragem permitiu viver, e que a força não deixou que imobilizasse o gesto, e levou aos passos mais adiante e aos caminhos mais além de antes do ontem.

A todos aqueles que, disponíveis para o novo, o invasivo, o ensaio, percorreram com seus olhos linhas como estas somando às nossas, as suas vivências, indagações e descobertas e fazendo com isso que amontoados de palavras se vestissem de significados, dedico esta mensagem como uma liberdade de aproximação, e um enorme desejo de que a busca de cada um não cesse nunca, seja ela qual for, por mais que mudem as respostas ou que às vezes, nos desanime a ausência delas. Um brinde aos encontros, que neste espaço de vida, puderam acontecer!                                


"
33,"
Graça atendida, grata a Deus 


                                    Meus Deus, meu bom Deus, me sinto neste momento uma das pessoas mais felizes do mundo. Tive a minha graça concedida e Te sou grata por teres me confiado esta missão. Senhor, sabes que sou uma pessoa crente, e que estou sempre tentando seguir o caminho da luz e da retidão, mas és Tu que tens a minha vida em Tuas mãos.

Meu Deus, eu Te agradeço com todo meu coração que tenhas escutado as minhas preces, e sentido aquilo que tenho em meu coração. Eu sei que nem sempre alcançamos aquilo que desejamos, e apesar da frustração, eu sei agradecer a Deus. Pois sei que se não tive um desejo concebido, é porque o Senhor tem outros planos para mim, e só me cabe resignar-me diante da sua sabedoria e agradecer. 

Mas desta vez, meu Deus, eu lutei, trabalhei duro, e pela Tua plena vontade tive a minha graça atendida e por isso Te sou eternamente grata. Obrigada, Senhor!                                


"
34,Carta de agradecimento ao cliente: 20 modelos para garantir a fidelização
35,"
Respire fundo e durma bem, amigo


                                    Respire fundo, agradeça pelas coisas boas do dia para que sua noite seja de paz, amigo. Quando a noite cai, é bom lembrar dos momentos bons que passaram.

Feche os olhos, faça uma pequena meditação de agradecimento para que seu corpo se desligue do dia e você possa relaxara. Garanta que seu coração e sua mente estão em paz para ter uma noite de paz.

Boa noite, amigo!                                


"
