,0
0,Parabéns para mim: dicas para celebrar o meu aniversário
1,Feliz aniversário amor: dicas para tornar o aniversário do seu amor em um dia inesquecível
2,"
Um aniversário de sonhos realizados, primo
Um dia e uma vida de sonhos realizados é o que lhe desejo, meu primo e irmão de coração. Feliz aniversário!

"
3,60 frases de aniversário para marido para encher o dia dele de amor e alegria
4,Como desejar feliz aniversário para alguém distante
5,"
Um aniversário repleto de amor para minha professo...
Foi você que me ensinou que tudo nesta vida deve ser vivido intensamente, querida professora. Por isso, aproveite cada segundo do seu aniversário.

Você é uma professora incrível e aprendi muito até aqui. Espero que seu dia seja repleto de alegria, que você nunca perca esta vontade tão bonita de compartilhar conhecimento. 

É uma verdadeira honra poder assistir suas aulas, porque você ensina com amor e esta é a melhor qualidade que podemos esperar de uma professora.

Que este novo ano seja repleto de alegria, sucesso e sorrisos, porque você merece tudo de mais lindo nesta vida.

Parabéns, minha professora preferida!

"
6,"
Sonhos são para serem realizados!
Tudo que sonhamos, seja fácil ou difícil de alcançar, nunca deve ser colocado apenas como um fruto da nossa imaginação, muito menos como algo impossível. Certamente o nível de dificuldade e de empenho que deverá ser depositado irá variar, mas jamais permita que seus sonhos sejam esquecidos simplesmente por não tentar conquista-los.

Com tantos exemplos de superação e vitórias, como você pode achar que apenas os seus sonhos são impossíveis de realizar? A diferença pode estar na simples ação de levantar e realmente se movimentar para concretizar.

Se você ficar esperando que o mundo se organize para transformar o seu sonho em realidade, pode até acontecer, pois nunca se sabe, mas com certeza a espera pode ser eterna, com grandes chances de permanecer para sempre como lindos pensamentos. Mas ao tentar com todo seu empenho e força de vontade, as chances de um final feliz aumenta em infinitas quantidades.

"
7,Feliz aniversário amigo: como dar parabéns e prestar homenagem a um amigo
8,100 frases de aniversário para filha para homenageá-la e celebrar seu dia com amor e alegria
9,"

Um aniversário repleto de sonhos realizados para minha sobrinha

 

                    Parabéns! Um dia emocionante cheio de boas escolhas, sonhos realizados e muitos, muitos presentes incríveis é o que desejo à minha sobrinha preferida! Sou uma tia feliz porque você existe, meu bem! 

Quero compartilhar com você que meu coração é totalmente apaixonado pelo seu e também que tenho um orgulho gigante por ser sua tia! Conte comigo para tudo que precisar na vida!

Divirta-se muito, hoje e sempre, e nunca desista de correr atrás do que lhe traz amor, paz e alegria! Só assim você se sentirá verdadeiramente realizada, meu bem. 

Tenha um aniversário muito feliz!                

"
10,Feliz aniversário mãe: ideias para comemorar a data especial da sua mamãe querida
11,"
Um aniversário repleto de alegrias para minha sogr...
Sinto uma felicidade enorme em poder estar por perto no seu dia especial, querida sogra. Você sabe que lhe tenho um carinho enorme, não só por você ter criado o amor da minha vida, mas também por ser uma mulher incrível.

Desejo que seu aniversário seja repleto de alegrias e que você possa encantar a todos com este seu sorriso bonito.

Tenha um aniversário maravilhoso! Parabéns!

"
12,"
Um aniversário repleto de amor para minha esposa
Minha amada, minha esposa, hoje o dia é todo seu! Que seu aniversário traga boas vibrações e que você se encante com a beleza da vida.

Nosso amor é o que tenho de mais especial e por isso farei de tudo para que você seja sempre a mulher mais feliz do mundo. Que seu dia seja incrível, pois você merece.

Estarei sempre aqui para lhe desejar um feliz aniversário e para encher seu dia de alegria e amor!

Parabéns!

"
13,Mundo das Mensagens
14,50 frases de aniversário para pai que vão deixar o dia dele mais feliz
