,0
312,"
É um privilégio ser padrinho


                                    Ser padrinho é ser pai
não de sangue, mas de coração, 
alma e para toda a vida.
Ser padrinho é um orgulho,
uma alegria e uma emoção.
É amar, cuidar e proteger
o filho de quem confiou em nós.
Ser padrinho é bom demais e
é uma responsabilidade grande,
mas acima de tudo é um privilégio!

Eu amo ser padrinho!                                


"
313,"
Um Parabéns Especial para Meu Pai


                                    Que não falte alegria, saúde e muito amor neste aniversário tão especial. Parabéns, pai!                                


"
314,"
Mensagem de luto para pai 


                                    Guiado pelas suas mãos, eu aprendi a andar, guiado pelos seus olhos, eu aprendi a ver o mundo. Na sua imensa generosidade e amor, você me acolheu em seus braços e em sua vida e doou-se a mim. Pai, você foi o meu porto seguro, a minha instância de paz, o meu ombro amigo, o meu maior mestre. E agora que você se foi, o vazio que deixa em minha vida é imensurável.

Guardamos na memória a sua imagem de serenidade e profunda sabedoria, e em nossos corações o seu amor incondicional. A lembrança do seu sorriso, que em tantos momentos de aflição nos consolou, é agora mais uma vez o que traz algum afago para os nossos corações. Lembraremos sempre de você com um sorriso no rosto, o mesmo sorriso que nos acalentou, que nos acalmou, e que nos ensinou, com muito amor e paciência, a seguir o caminho do bem e da retidão.

Pai, a sua memória será para sempre honrada, o seu nome e a sua história serão sempre repetidos com amor, carinho e respeito. Você continuará eternamente presente em nossas vidas e em nossos corações.

Vá em paz, e siga o caminho que Deus lhe convidou a seguir.                                


"
315,"
Sinto Sua Falta Em Toda Parte


                                    Sinto sua falta em toda parte! A saudade é agora meu gênero de vida, porque você, meu querido pai, representa tudo para mim. Desde que se foi, tenho tentado reaprender a viver; tenho conquistado meu caminho bem devagar. 

Sinto que esse luto nunca vai terminar completamente! Onde você estiver, pode ter certeza que meu orgulho e admiração não conhecem fim. Ser seu filho é o maior presente que a vida me ofereceu!                                


"
316,"
Ser pai adotivo é ser maior

 


                                    Ser pai adotivo é ser maior. É ter de lutar para conquistar e não simplesmente ser amado por um dia ter gerado. Ser pai adotivo é ter a bênção da vida em suas mãos, é cuidar e amar como se se tratasse de uma criação sua.

E isso é ser pai de verdade. Não importam os títulos ou categorias, mas sim o sentimento que prende e dá asas ao mesmo tempo. Esse sentimento é coisa rara, bela e só existe entre um pai e seu filho, seja ele de sangue ou não.                                


"
317,"
O maior amor da sua vida está a caminho, papai


                                    Ainda não coheço você, mas já sei que o irei amar toda a minha vida. 

Serei a principal causa dos seus primeiros cabelos brancos, mas em troca lhe darei as maiores das alegrias. Vai ser uma vida muito feliz e mal posso aguardar para o conhecer.

Por isso, se prepare para me pegar ao colo muitas vezes e para sentir o maior amor da sua vida. Beijão, papai!                                


"
318,"
Um padrasto e um amigo para toda hora


                                    Para mim você é um segundo pai e um amigo com quem posso contar a toda hora. Agradeço por tudo, padrasto!                                


"
319,"
Busque a Deus e seja grato a Ele


                                    Cada dia é uma nova oportunidade de vivermos uma vida que nos foi amorosamente concedida. Devemos aproveitar esse presente por usufruirmos verdadeiramente de cada momento, mas também por darmos honra a quem nos estende essa mesma possibilidade: Deus.

Infelizmente, vivemos em uma sociedade onde não existe esse critério nem essa gratidão. As pessoas são escravas dos seus próprios desejos, estão aprisionadas nas suas próprias rotinas e simplesmente não querem perder tempo refletindo e prestando reverência ao Ser superior que nos concede tudo que temos.

Antes de sair de casa, pense nas coisas positivas que tem na sua vida, peça ajuda ao nosso Pai para saber o que fazer perante os desafios e parta com determinação em busca daquilo que lhe trará felicidade. O esforço que dedicamos em viver de acordo com os princípios divinos nunca será em vão. Tenha um dia maravilhoso!                                


"
320,"
Saudades da família que eu amo


                                    Só quando estamos longe de tudo e todos é que damos valor ao que de mais importante nós temos. Esta distância tem me ensinado, da maneira mais dura, como a família é essencial para a nossa vida. Sinto a falta de todos e o que eu mais desejava agora era estar aí em casa com vocês.

Um beijo carinhoso para vocês, daqueles que atravessa qualquer distância!                                


"
321,"
Mãe, você me ensinou como ser pai


                                    Mãe, eu costumava não entender porque você queria estar sempre comigo em todos momentos, mas hoje que sou pai sei o que é querer estar junto com nossos filhos em cada segundo das suas vidas. Talvez seja por isso que hoje valorize ainda mais o amor que você me deu por toda a vida.

Talvez não tenha sido sua intenção, mas pelo carinho e atenção que ganhei de você, hoje me sinto preparado para cuidar dos meus filhos com o mesmo afeto que fui criado por você. Mãe, você é o meu maior exemplo! Obrigado por tudo!                                


"
322,"
O que é ser um bom pai


                                    O que faz de um homem um bom pai não é a biologia, a capacidade de procriar. Ter filhos não é só gerar e dar nome. E isso eu aprendi com você, meu pai. 

Pois eu tive a sorte de crescer e aprender tudo com o melhor homem, o melhor pai. E você me ensinou que ser pai é amar, apoiar, compreender e repreender se necessário. 

Que ser pai é estar sempre presente e lutar todos os dias pela felicidade dos filhos. Você continua demonstrando que ser pai é ser carinhoso e paciente, brincar e descobrir o mundo ao lado dos filhos. 

Eu te amo, meu pai! E todos os dias agradeço por ter você como pai, o melhor de sempre!                                


"
323,"
Orgulho, amor e vaidade de um pai para sua filha


                                    Será que existe algum pai tão orgulhoso e vaidoso como eu em relação à sua filha? Eu não sei, mas tenho certeza que mais satisfação do que eu ninguém pode sentir. Eu te adoro, querida!

Você é a menina que sempre viveu no meu coração. Desde aquele momento incrível que meu olhar se cruzou com seu corpo pequenino e fofinho, tudo virou alegria no meu viver.

E todos os dias, minha filha, eu sinto a mesma coisa: felicidade. E você é a razão de a sentir. Não importa se você faz certo ou errado. A única coisa que interessa é o amor e esse nós temos de sobra. 

Tenha um dia e uma vida sempre magníficas, filha! E lembre-se que em qualquer situação eu estarei perto, bem junto de você. Esse é o meu lugar, querida, e sempre será! Um beijo.                                


"
324,"
Minha grávida mais linda


                                    Meu amor, nunca imaginei que um dia você pudesse ficar ainda mais linda do que era, mas desde que nós recebemos a notícia do nosso presente que está vindo do céu para entrar em nossas vidas, uma luz linda passou a iluminar o seu rosto. Você está cada dia mais bonita, mais forte, mais apaixonante. 

Quando olho para você e para a sua barriga, e penso no nosso bebê aí dentro, tão guardadinho, o amor toma conta de mim, do meu coração, do meu corpo e da minha alma. Nunca pensei que existia amor assim, tão intenso, tão pleno e tão feliz.

Você é a mulher da minha vida, me sinto muito realizado com tudo que está acontecendo conosco, e sei que está só começando, a nossa felicidade ainda vai crescer muito mais, vamos ficar muito mais unidos do que antes. Sinto-me realmente um privilegiado por ser o seu marido, por ser o pai deste filho que você está guardando para nós.

Obrigado pelo seu amor, obrigado por me fazer o homem mais feliz de todo mundo! Eu amo muito você, amo muito o que nós dois temos, e vou amar ainda mais nós três!                                


"
325,"
Pais dedicados merecem tudo


                                    Vocês lutam, esforçam-se, não desistem! Pessoas assim, pais dedicados merecem todo bem que existe neste mundo. A quem tem sempre uma solução e consegue com o coração guiar seus filhos só merece ser feliz!

Nem sempre é fácil desempenhar o papel de pai, mas quando estiver difícil lembrem-se que esta é uma tarefa para guerreiros, para vencedores. Vocês, pais maravilhosos, são batalhadores e jamais conhecerão o sabor da desistência.

Vocês são um exemplo para este mundo, para as pessoas, para seus filhos. Não esperem reconhecimento com dinheiro ou luxo, mas preparem-se para receber todo amor dos filhos. E esse é o maior legado e presente que existe.                                


"
326,"
O aniversário do melhor marido e melhor pai


                                    Hoje é dia de festejar o aniversário do melhor marido e melhor pai do mundo. Parabéns, meu amor! No que depender de nós seu dia será perfeito, pois tudo que mais desejamos é fazê-lo feliz. Assim como você todos os dias se esforça por nos fazer felizes.

Você é muito especial e um exemplo de homem, marido e pai, e merece todas as homenagens, elogios e principalmente toda felicidade do mundo. Nunca se esqueça ou duvide que todos nós amamos muito você! Feliz aniversário!                                


"
327,"
Saudades de Meu Pai


                                    Uma parte de mim foi embora com você, meu pai! Desde a hora que você se foi, minha vida virou mar sem onda. Não importa o tempo, não interessam novas chances na vida, porque sem você junto a mim tudo é cinzento, tudo é sem graça. Na verdade, meus sonhos viraram nostalgia, meus projetos não passam de pedra na calçada! Sinto muito sua falta!

Você foi embora faz tempo. Sinto que é hora de retomar minha vida, de colocar um sorriso no rosto sem sentir culpa. Eu sei que você pretende o melhor para mim, mas não tenho conseguido viver direito. Então, me ajude! Me dê força! Faça com que a fé invada novamente meu coração. Preciso de jogar fora essa tristeza que me impede de continuar meu caminho! 

Eu vou conseguir dar a volta por cima! Tenho de acreditar que a vida continua. Preciso honrar seu nome através de minha felicidade, de meu sucesso. Esse será meu grande objetivo, meu pai! Até um dia!                                


"
328,"
A Imortalidade do Meu Pai


                                    Sua casa continua a ser meu coração, meu pensamento; minhas memórias, minha vida. Você vai estar sempre vivo em mim, meu pai. 

Especialmente hoje, seu nome é lembrado intensamente, é recordado com o carinho com que sempre tratou todo mundo. Seus atos, seu percurso, sua imortalidade, tudo isso é lembrado. Eu gosto muito de você, meu pai. Até um dia!                                


"
329,"
Orgulhoso de ser seu pai, filho


                                    Meu filho, ver seu sorriso e seus olhos brilharem é tudo que eu preciso para me sentir feliz e realizado. Você não imagina como é grande o meu amor por você e o orgulho que sinto por ser seu pai. 

Em você eu vejo o melhor de mim e não tenho qualquer dúvida quando digo que você é o melhor que já me aconteceu. 

Obrigado, filho, por ter vindo me dar ainda mais razões para viver e ser feliz!                                


"
330,"
Parabéns papai do meu coração


                                    Feliz aniversário, meu pai! Espero que este dia trate bem do seu coração, pois meu herói de toda vida merece ser feliz e desfrutar de todas as alegrias.

Desde que nasci você tem sido meu exemplo de homem, de honestidade, de justiça e bondade. Sua marca em mim é eterna e por você eu quero ser sempre uma pessoa melhor.

Seja feliz, meu pai, hoje, amanhã e sempre! Mas hoje em especial receba as homenagens sem modéstia, pois você merece muito ser bajulado. Te amo muito!                                


"
331,"
Para o melhor papai do mundo


                                    Papai, hoje quero aproveitar o dia para agradecer por quem você é. Eu sou muito bebê ainda, mas quero que saiba que eu sinto seu amor todos os dias.

Quando você me pega nos braços, sinto uma proteção incrível e sei que nada de ruim poderá acontecer comigo. Você faz eu me sentir em paz.

Espero que quando eu crescer, eu seja como você, uma pessoa atenciosa e cheia de amor para dar. Papai, agradeço por todos os abraços e carinhos que você me dá diariamente.

Você é o melhor papai do mundo!                                


"
332,"
Os seus primeiros passos como pai


                                    Parabéns! A cada dia que passa, está mais perto de iniciar a sua nova aventura pelo mundo da paternidade.

O seu bebê e você têm algo em comum: ambos estarão dando os primeiros passos em um mundo desconhecido, mas se derem as mãos irão ambos encontrar o caminho que devem seguir.                                


"
333,"
Sou pai de vários jeitos


                                    Às vezes sou um pai brincalhão,
outras vezes muito sério.
Às vezes digo que não, outras
vezes acabo cedendo.

Tem dias que sou mais aprendiz
e apenas observo, outros dias
tenho que ensinar e tento
fazer com todo o amor do mundo.

Alguns dias estou cansado,
outras vezes mais dispostos.
Mas sou sempre pai,
este que tenta fazer o seu melhor
e dar aos filhos tudo que tenho
para oferecer.

Ser pai é ser muitos
e ao mesmo tempo, 
ser um só, que ama, cuida e protege!                                


"
334,"
Sou um Bebê muito Amado


                                    Vocês são tudo que existe de maravilhoso. É incrível como cuidam de mim e de tudo aquilo que preciso. Sou um bebê muito feliz e realizado porque tenho ao meu lado os pais mais lindos e atenciosos do mundo. 

Espero, um dia, reconhecer com toda minha gratidão todas as coisas que você me proporcionam. Desde a educação, aos princípios e ao carinho e amor vocês sempre me deram tudo. Adoro vocês, pai e mãe!                                


"
335,"
Aprendendo a ser Pai


                                    Aprender a ser pai não é tarefa fácil nem acontece de um dia para outro. Mas também não há um jeito perfeito de ser pai. 

Pois o importante é que haja amor, dedicação e honestidade. O que conta é estar presente na vida dos filhos, é lutar todos os dias pela felicidade deles. O que realmente faz de um homem um bom pai é o amor incondicional que ele sente pelos seus filhos. 

Na verdade, aprender a ser pai é aprender a amar alguém mais que a si próprio, é ser herói e guerreiro e ter como única recompensa um sorriso e o amor infinito dos filhos. E melhor recompensa que essa é impossível encontrar!                                


"
336,"
Você é minha Sorte, Pai



"
337,"
Uma novidade maravilhosa


                                    Querido papai, desde sempre você tem sido um dos pilares mais fortes e importantes da minha vida. Você é um exemplo de homem, marido e principalmente de pai. Seu coração é generoso e honesto, e seu espírito jovial e alegre.

Sei que acalenta muitos sonhos, para você e para aqueles a quem ama, e hoje eu quero lhe dizer que um deles se cumpriu. E como você sempre foi o melhor dos pais, sei que agora será... o melhor dos avós!

Sim, querido pai, você será vovô de primeira viagem. Parabéns!                                


"
338,"
Vocês são um maravilhoso exemplo de amor


                                    Quando ouço falar em amor, vocês são o primeiro casal que surge no meu pensamento. O carinho que dedicaram a cada dia do casamento tornou possível que chegassem felizes até aqui e hoje todos celebramos vinte e cinco anos de um lindo enlace matrimonial. 

Vocês são os melhores pais deste mundo e é um orgulho pertencer a uma família tão unida assim. Desejo que possamos contar mais anos ainda e que todos eles sejam ricamente abençoados. 


"
339,"
Uma Admiração Eterna, Meu Pai

 


                                    Não imagino ter outro pai senão você! É uma sensação de orgulho quando falo do homem que você é e de tudo que representa para mim como ser humano, como pessoa. 

É uma admiração constante e eterna. Se todos os filhos tivessem pais como você, o mundo seria uma espécie de irmandade onde todos seriam amigos e ninguém faria mal, mentia ou enganava. Seria um mundo de valores fortes na justiça e igualdade. E todos celebraríamos o amor! Agradeço por tudo, meu pai!                                


"
340,"
Deus está sempre ao nosso lado, amigos


                                    Meus amigos, não se deixem levar pelas dificuldades da vida, não se deixem vencer pelas tristezas. Pois acenteça o que acontecer sempre terão uma mão amiga e toda poderosa a quem recorrer. 

Deus está ao lado de todos, e aqueles que acreditam n’Ele, aqueles que apesar de atravessarem as maiores tribulações O levam sempre no coração, terão grande recompensa. 

Pois Deus é justo e atento, e saberá entregar a cada um o que cada um semeou para si. Tenham fé e esperança, pois Deus é nosso Pai amigo, nosso protetor constante e eternamente presente!                                


"
341,"
Uma carta em forma de poema para meu pai


                                    Pai, sou um bebê igualzinho
a qualquer outro mas disponho
de algo distinto e muito especial;
estou me referindo a você.

Estou ansioso para brincar na
praia com você; mamãe já me
falou que seu pé é bom para 
marcar gol, mas duvido que 
bata o meu que será melhor.

Estou ansioso por passar meus
dedos pelo seu cabelo e no seu
rosto deixar a marca de meu 
beijo gostoso; ansioso, porque
para mim você é a razão de tudo.

Pai, você é o herói da minha 
vida, aquela pessoa que por
mim tenho certeza que faria
tudo e largaria tudo... por mim.                                


"
342,"
Um amigo especial igual meu padrasto

 


                                    Eu gostaria que todo mundo tivesse na vida um amigo igual você é para mim. Nunca o enxerguei como um padrasto, como alguém que complementa o papel de um pai. Para mim você sempre foi tudo!

Gosto da sua forma de ver a vida, de cuidar de tudo e de todos ao seu redor. Aprecio profundamente seu jeito inspirador de sonhar e correr atrás da realização de todos seus sonhos. 

Mais do que um exemplo para mim, você será sempre parte de quem eu sou. Somos a prova de que o sentimento tem origem no coração e nem sempre do sangue. Gosto muito, muito de você!                                


"
343,"
A imensa saudade que sinto do meu pai


                                    Não há um dia que não pense no meu pai e sinta a falta que ele faz na minha vida. Saudades suas, pai.                                


"
344,"
Há 3 anos a construir uma família

 


                                    Três anos se passaram desde o dia em que celebramos em uma linda festa, junto de amigos e familiares, o nosso amor. E três anos depois descobri que casei com o melhor homem, melhor marido e melhor pai. Feliz aniversário de casamento, meu amor!

Dia a dia escrevemos nossa história e construímos uma família, e desde o início damos prioridade à nossa felicidade, sem dar importância ao que é superficial. 

Que assim continuemos sempre, lado a lado, lutando por nossa família e nosso amor. Sou muito feliz ao seu lado, e apenas quero fazê-lo também feliz. Te amo!                                


"
345,"
Papai e Mamãe - Os Meus Heróis


                                    Vocês são meus heróis. São o pai e a mãe que qualquer bebê como eu desejaria ter. Sinto uma proteção sem limitações e um cuidado e atenção indescritíveis. Sou um bebê muito feliz porque vocês existem. 

Só espero que se sintam orgulhosos comigo e com todas as coisas que vou proporcionar com o tempo. Amo cada um de vocês com todo meu coração. Beijos, papai e mamãe!                                


"
346,"
Só terá a atenção do seu filho


                                    Esta será a última altura em que um pai de primeira viagem receberá alguma atenção.

Durante os próximos nove meses e durante os primeiros tempos de vida do bebê, a mãe será a rainha e é dela que todo o mundo vai falar. 

Depois  todas as atenções se irão concentrar no bebê, muito provavelmente até voltar a ser adulto.

Mas a compensação é que será sempre o centro das atenções do seu filho. Parabéns!                                


"
347,"
As saudades que eu tenho de você, meu pai


                                    Tenho saudades do seu abraço, meu pai, de todos os conselhos que só você sabia dar e de me sentir protegida por não estar sozinha em casa. Sinto falta dos lindos momentos que sempre passávamos em família e que agora não acontecem mais.

Você partiu e as dores da sua ausência parecem não ter fim. Está difícil seguir em frente, mas vou continuar tentando. Enfrentarei a tristeza com todas as forças, imaginando que você está olhando para mim. 


"
348,Para um pai se tornar herói
349,"
Meu amigo, o papai de primeira viagem


                                    Meu grande amigo, que emoção enorme que você deve estar sentindo! Nasceu o seu bebê e agora virou papai de primeira viagem! Parabéns!

Muita coisa na sua vida irá mudar e agora vai ser um pouco mais difícil de vê-lo, mas sei que é por uma ótima razão, aliás, a melhor da razões! Aproveite cada segundo da vida de papai!

Sei que esta viagem pode parecer assustadora algumas vezes, mas não se importe com as turbulências, pois o destino é o melhor que a vida pode oferecer.

Desejo sorte nesta fase incrível e totalmente nova que está começando! Fico muito feliz por você e pela família linda que formou.                                


"
350,"
A Riqueza e a Pobreza


                                    Um dia, um pai de família rica levou seu filho para viajar para o interior com o firme propósito de mostrar quanto as pessoas podem ser pobres.

Eles passaram um dia e uma noite na fazenda de uma família muito pobre.

Quando retornaram da viagem, o pai perguntou ao filho:

""- O que achou do que viu?""

O filho respondeu:

""- Foi muito legal, pai !""

""- Você viu como as pessoas pobres podem ser? ""

O pai perguntou.

""- Sim."" - respondeu o filho.

""-E o que você aprendeu ?"" - o pai perguntou.

O filho respondeu:

""- Eu vi que nós temos um cachorro em casa e eles tem quatro.""

""- Nós temos uma piscina que alcança o meio do jardim e eles tem um riacho que não tem fim.""

""- Nós temos uma varanda coberta e iluminada com luz e eles tem as estrelas e a lua.""

""-Nosso quintal vai até o portão de entrada e eles tem uma floresta inteira.""

Quando o pequeno garoto estava acabando de responder, seu pai ficou estupefato.

Seu filho acrescentou:

""- Obrigado pai, por me mostrar quanto pobres nós somos !""

Não é verdade que tudo depende da maneira como você olha para as coisas?

Se você tem amor, amigos, família, saúde, bom humor e atitudes positivas para com a vida, você tem tudo!                                


"
351,"
Parabéns ao futuro papai

 


                                    Sua barriga não vai crescer, não sentirá enjoos matinais nem desejos estranhos. Mas abra mais espaço em seu peito, pois seu coração vai crescer com todo o amor que esse bebê fará nascer em você. Parabéns, futuro papai! 

Este é o início de uma fase que será para sempre, trará muitas alegrias e preocupações, mas será sempre compensador. 

Ser pai é uma dádiva maravilhosa, é criar um laço eterno com outro ser, e não tenho qualquer dúvida que você será um pai maravilhoso. Desfrute de cada momento, e muitas felicidades para todos!                                


"
352,"
Meu dia dos pais sendo papai de primeira viagem


                                    Ser pai de primeira viagem é uma aventura e tanto. Hoje é meu primeiro dia dos pais ao lado do meu lindo bebê e eu não poderia estar mais feliz. Quero passar o dia todo com ele no colo, curtindo cada momento deste afeto.

Tem sido uma jornada inspiradora e a cada dia aprendo um pouquinho mais o que é ser pai. Ainda temos muito pela frente. Mas passar este dia dos pais ao lado da minha família é o que faz tudo valer a pena! Estou muito feliz em ser papai!                                


"
353,"
Mãe, em mim nunca morrerás


                                    Descanse em paz, mãe, eu chorarei sua despedida e recordarei seu nome e legado todos os dias.                                


"
